"option","baseline_value","safety_stress","equity_stress","security_stress","drift_stress","evidence_quality","oversight_strength","equity_score","transparency_score","security_readiness","implementation_feasibility","description","expected_governance_value","worst_case_value","scenario_dispersion","ai_governance_score","review_flag","rank"
"Reject Use Case",35,80,78,82,84,0.9,0.88,0.86,0.82,0.9,0.92,"Rejects deployment and avoids AI-specific harms but forgoes operational value",64.85,35,20.6929939834718,0.699118682710742,"review",3
"Pilot With Strong Controls",68,70,74,72,76,0.72,0.84,0.78,0.76,0.74,0.7,"Limited pilot with strong safeguards validation monitoring and review authority",71.1,68,3.16227766016838,0.745367259572885,"acceptable",2
"Limited Internal Deployment",74,62,60,64,58,0.66,0.68,0.64,0.66,0.68,0.76,"Internal deployment with moderate safeguards and operational value",65.6,58,6.22896460095897,0.649389427730776,"acceptable",4
"High-Stakes Deployment",84,42,38,46,40,0.48,0.46,0.42,0.44,0.48,0.56,"High-value high-stakes deployment with weak controls and unacceptable stress performance",56.4,38,19.2353840616713,0.42790564250221,"review",6
"Vendor Tool With Audit Rights",70,58,56,60,54,0.62,0.62,0.58,0.6,0.64,0.68,"Vendor system with some governance rights but unresolved stress and drift concerns",61.6,54,6.22896460095897,0.598989427730776,"acceptable",5
"Adaptive Governance Rollout",78,76,80,78,82,0.76,0.82,0.8,0.78,0.82,0.72,"Staged rollout with monitoring thresholds escalation controls and adaptive safeguards",78.5,76,2.28035085019828,0.791719064399471,"acceptable",1
