"case","prior","sensitivity","false_positive_rate","action_success_utility","action_false_positive_cost","inaction_miss_cost","inaction_true_negative_utility","description","posterior","bayes_factor","posterior_odds","action_utility","wait_utility","utility_difference","recommended_action","posterior_review_flag"
"Diagnostic Case",0.1,0.86,0.12,90,-25,-80,15,"Clinical-style diagnosis and treatment decision",0.443298969072165,7.16666666666667,0.796296296296296,25.979381443299,-27.1134020618557,53.0927835051546,"Act","stable under baseline assumptions"
"Model Drift Case",0.18,0.78,0.16,75,-18,-70,12,"AI model monitoring and drift response decision",0.516936671575847,4.875,1.07012195121951,30.0751104565537,-30.3888070692194,60.4639175257732,"Act","stable under baseline assumptions"
"Policy Pilot Case",0.35,0.7,0.22,65,-20,-55,10,"Public policy pilot evidence and scale decision",0.631443298969072,3.18181818181818,1.71328671328671,33.6726804123711,-31.0438144329897,64.7164948453608,"Act","stable under baseline assumptions"
"Cybersecurity Case",0.08,0.82,0.1,85,-30,-90,18,"Security alert escalation and containment decision",0.416243654822335,8.2,0.713043478260869,17.8680203045685,-26.9543147208122,44.8223350253807,"Act","stable under baseline assumptions"
"Infrastructure Case",0.22,0.74,0.18,70,-22,-75,14,"Asset inspection and maintenance decision",0.536939313984169,4.11111111111111,1.15954415954416,27.3984168865435,-33.787598944591,61.1860158311346,"Act","stable under baseline assumptions"
