"strategy","resilience_score","adaptability_score","near_term_cost","long_term_value","reversibility","description","long_horizon_score","average_scenario_performance","worst_case_performance","performance_range","threshold_pass_rate","resilient_decision_score","review_flag","rank"
"Modular Adaptive Path",0.82,0.84,0.56,0.86,0.81,"Modular strategy preserving flexibility resilience and reversibility across futures",0.6666,0.786,0.74,0.1,1,0.72542,"acceptable",1
"High-Redundancy Resilience Path",0.86,0.71,0.61,0.84,0.66,"High-buffer strategy emphasizing redundancy recovery and continuity",0.6098,0.78,0.7,0.18,1,0.69334,"acceptable",2
"Transformative Long-Horizon Path",0.79,0.88,0.73,0.91,0.58,"Transformative strategy with high long-term value and strong adaptability but higher near-term cost",0.6184,0.756,0.68,0.14,0.8,0.65216,"acceptable",3
"Balanced Adaptive Path",0.68,0.74,0.42,0.77,0.72,"Balanced long-horizon strategy with moderate cost and strong adaptive potential",0.59,0.704,0.66,0.1,0.6,0.59316,"acceptable",4
"Short-Term Efficiency Path",0.34,0.29,0.18,0.41,0.3,"Lean short-term strategy with low cost but weak resilience and adaptability",0.2762,0.442,0.3,0.44,0.2,0.26454,"review",5
