"dimension","current_maturity","target_maturity","gap","priority","notes","review_flag"
"AI support quality",0.62,0.86,0.24,"high","AI support should include validation uncertainty monitoring and human oversight","acceptable"
"Governance maturity",0.58,0.9,0.32,"high","Decision rights records review and corrective authority need strengthening","review"
"Uncertainty capability",0.6,0.88,0.28,"high","Scenario analysis sensitivity review triggers and robust pathways need expansion","acceptable"
"Participatory legitimacy",0.46,0.84,0.38,"high","Stakeholder standing and public reasoning should shape framing and criteria","review"
"Reproducibility",0.54,0.88,0.34,"high","Data code assumptions outputs and records should be rerunnable and inspectable","review"
"Systems awareness",0.5,0.86,0.36,"high","Feedback loops network effects cascading risk and resilience need better representation","review"
"Ethical accountability",0.52,0.9,0.38,"high","Equity power contestability and remedy should be embedded in decision design","review"
"Adaptive capacity",0.56,0.88,0.32,"high","Monitoring thresholds and revision authority should be formalized","review"
